{
  "$schema": "../schema/about.json",
  "description": {
    "ca": [
      "<strong>Estructuras 3000</strong> és un col·lectiu artístic en forma d’associació sense ànim de lucre que té com a objectiu <strong>realitzar, vetllar i divulgar les pràctiques col·lectives i col·laboratives en el context artístic i cultural català.</strong> L'acció de l'entitat vol donar resposta a les dinàmiques habituals cap a un individualisme que atempta contra l'organització del col·lectiu artístic i l'accés democràtics als drets culturals, és per això que l'associació vetlla per la producció d'infraestructures, investigacions, tallers i accions en institucions del territori català per la col·lectivització del sector i les pràctiques artístiques.",
      "El local d’Estructuras 3000 és un <strong>espai col·laboratiu amb tallers comunitaris</strong> dedicats a la creació, l’experimentació i la producció. Cada taller compta amb una persona responsable membre de l’associació i els materials amb una selecció d’ús compartit. L’ús dels espais es basa en la <strong>cura col·lectiva, l’autogestió i el respecte pel treball comú.</strong>",
      "Estructuras 3000 treballa per generar oportunitats per a altres col·lectius, contribuir a la defensa d'una remuneració justa, els drets culturals i a la professionalització de les pràctiques col·lectives contemporànies."
    ],
    "es": [
      "<strong>Estructuras 3000</strong> es un colectivo artístico en forma de asociación sin ánimo de lucro que tiene como objetivo <strong>realizar, velar y divulgar las prácticas colectivas y colaborativas en el contexto artístico y cultural catalán.</strong> La acción de la entidad quiere dar respuesta a las dinámicas habituales hacia un individualismo que atenta contra la organización del colectivo artístico y el acceso democrático a los derechos culturales, por eso la asociación vela por la producción de infraestructuras, investigaciones, talleres y acciones en instituciones del territorio catalán para la colectivización del sector y las prácticas artísticas.",
      "El local de Estructuras 3000 es un <strong>espacio colaborativo con talleres comunitarios</strong> dedicados a la creación, experimentación y producción. Cada taller cuenta con una persona responsable miembro de la asociación y los materiales con una selección de uso compartido. El funcionamiento se basa en el <strong>cuidado colectivo, la autogestión y el respeto por el trabajo común.</strong>",
      "Estructuras 3000 trabaja para generar oportunidades para otros colectivos, contribuir a la defensa de una remuneración justa, los derechos culturales y a la profesionalización de las prácticas colectivas contemporáneas."
    ],
    "en": [
      "<strong>Estructuras 3000</strong> is an artistic collective organized as a non-profit association whose aim is to <strong>carry out, safeguard, and disseminate collective and collaborative practices in the Catalan artistic and cultural context.</strong> The entity's action seeks to respond to the usual dynamics toward individualism that threaten the organization of the artistic collective and democratic access to cultural rights; this is why the association promotes the production of infrastructures, research, workshops, and actions in institutions across Catalonia for the collectivization of the sector and artistic practices.",
      "The Estructuras 3000 space is a <strong>collaborative space with shared workshops</strong> dedicated to creation, experimentation, and production. Each workshop has a designated member of the association, and materials are shared accordingly. The space operates through <strong>collective care, self-management, and respect for shared work.</strong>",
      "Estructuras 3000 works to generate opportunities for other collectives, contribute to the defense of fair remuneration, cultural rights and the professionalization of contemporary collective practices."
    ]
  },
  "services": {
    "ca": [
      {
        "title": "FONS INFRAESTRUCTURES: Arxiu de pràctiques artístiques en col·lectivitat i col·laboratives de Catalunya.",
        "content": [
          "Què és INFRAESTRUCTURES? És un fons documental i bibliogràfic sobre pràctiques d’organització col·lectiva i creació artística col·laborativa a Catalunya.",
          "El fons està constituït per un conjunt coherent i especialitzat de textos, documents, llibres, fanzins, publicacions independents i materials autoeditats, així com documentació complementària vinculada a propostes catalanes d’organització col·lectiva, autoorganització cultural i pràctiques artístiques col·laboratives.",
          "La finalitat del fons és preservar la memòria de les pràctiques col·lectives i artístiques contemporànies de Catalunya, facilitar la recerca i la divulgació cultural i garantir la transmissió de coneixement productiu de col·lectivitat.",
          "<a href=\"https://docs.google.com/spreadsheets/d/1Rl2r5tvw1Tzj45KfsR0lO6Dsi7_Oeg1gTWvdIFwS2WQ/edit?gid=0#gid=0\">Link al catàleg digital del fons</a>.",
          "Aquest fons bibliogràfic està supervisat sota la cura d'una arxivera."
        ]
      },
      {
        "title": "PASSAPORT DE FUSTES: Sistema cooperatiu de reutilització d'infraestructures culturals",
        "content": [
          "Transformem materials descartats en infraestructures culturals amb memòria. Recuperem, documentem i reactivem fustes procedents de museus, centres d'art, festivals i espais culturals perquè continuïn generant cultura en lloc de convertir-se en residus.",
          "<span class=\"servei-cta-row\"><a class=\"servei-cta\" href=\"proyecto.html?slug=passaport-de-fustes&amp;lang=ca\">Descobreix el projecte</a><a class=\"servei-cta\" href=\"proyecto.html?slug=col-labora&amp;lang=ca\">Vols col·laborar?</a></span>"
        ]
      },
      {
        "title": "RESIDÈNCIA COL·LECTIUS: Residència artística de mitja-llarga durada per a col·lectius artístics.",
        "content": [
          "Què és la residència de col·lectius? La residència artística per a col·lectius d’Estructuras 3000 és un programa de creació i recerca adreçat a col·lectius que treballen des de pràctiques col·laboratives, experimentals i crítiques. Amb una durada de vuit mesos, ofereix accés a tallers especialitzats, fons bibliogràfic, espais de convivència i assessorament tècnic, fomentant processos compartits que connecten producció material, pensament crític, sostenibilitat i territori. El programa impulsa metodologies no jeràrquiques i genera un arxiu públic dels processos desenvolupats, reforçant les xarxes col·lectives dins el context de les arts visuals a Catalunya."
        ]
      },
      {
        "title": "MEMBRESIA AMISTAT: Quota anual per donar suport al col·lectiu que inclou una peça artística cada any.",
        "content": [
          "Què és MEMBRESIA AMISTAT? A Estructuras 3000 activem una nova quota de membresia pensada per donar suport directe a la nostra feina activista en la promoció i reproducció d’un model alternatiu de producció, basat en les pràctiques artístiques col·lectives.",
          "Fer-te membre és apostar per:",
          "- La promoció de les pràctiques col·lectives i col·laboratives.",
          "- Col·laborar en l’ampliació i manteniment del Fons Infraestructures.",
          "- Vetllar per la sostenibilitat cultural.",
          "La membresia (40 € l’any) inclou:",
          "- Accés al Fons Infraestructures: arxiu de pràctiques artístiques en col·lectivitat i col·laboratives de Catalunya.",
          "- Un descompte en el lloguer de material del Passaport de Fustes.",
          "- Una peça artística produïda per la comunitat d’Estructuras 3000.",
          "Escriu-nos per fer-te amic/amiga a <a href=\"mailto:estructuras3000info@gmail.com?subject=membresia%20amistat\">estructuras3000info@gmail.com</a>.",
          "Gràcies per sostenir el que és col·lectiu."
        ]
      }
    ],
    "es": [
      {
        "title": "FONS INFRAESTRUCTURES: Archivo de prácticas artísticas colectivas y colaborativas de Cataluña.",
        "content": [
          "¿Qué es INFRAESTRUCTURES? Es un fondo documental y bibliográfico sobre prácticas de organización colectiva y creación artística colaborativa en Cataluña.",
          "El fondo está constituido por un conjunto coherente y especializado de textos, documentos, libros, fanzines, publicaciones independientes y materiales autoeditados, así como documentación complementaria vinculada a propuestas catalanas de organización colectiva, autoorganización cultural y prácticas artísticas colaborativas.",
          "La finalidad del fondo es preservar la memoria de las prácticas colectivas y artísticas contemporáneas de Cataluña, facilitar la investigación y la divulgación cultural y garantizar la transmisión de conocimiento productivo de la colectividad.",
          "<a href=\"https://docs.google.com/spreadsheets/d/1Rl2r5tvw1Tzj45KfsR0lO6Dsi7_Oeg1gTWvdIFwS2WQ/edit?gid=0#gid=0\">Enlace al catálogo digital del fondo</a>.",
          "Este fondo bibliográfico está supervisado bajo el cuidado de una archivera."
        ]
      },
      {
        "title": "PASSAPORT DE FUSTES: Sistema cooperativo de reutilización de infraestructuras culturales",
        "content": [
          "Transformamos materiales descartados en infraestructuras culturales con memoria. Recuperamos, documentamos y reactivamos maderas procedentes de museos, centros de arte, festivales y espacios culturales para que sigan generando cultura en lugar de convertirse en residuos.",
          "<span class=\"servei-cta-row\"><a class=\"servei-cta\" href=\"proyecto.html?slug=passaport-de-fustes&amp;lang=es\">Descubre el proyecto</a><a class=\"servei-cta\" href=\"proyecto.html?slug=col-labora&amp;lang=es\">¿Quieres colaborar?</a></span>"
        ]
      },
      {
        "title": "RESIDENCIA COLECTIVOS: Residencia artística de media-larga duración para colectivos artísticos.",
        "content": [